{
 "schema_version": 1,
 "record_type": "change_assurance",
 "record_id": "change-1",
 "revision": 1,
 "subject": {
  "repository": "agent-ix/quoin",
  "base_revision": "abc123",
  "scope": [
   "src/change-assurance"
  ]
 },
 "source_connections": [
  {
   "source_id": "FR-068",
   "kind": "requirement",
   "revision": "1"
  }
 ],
 "impact_snapshot": {
  "identity": "impact-1",
  "revision": "1",
  "completeness": "complete",
  "truncated": false,
  "gaps": []
 },
 "definition": {
  "requirements": [
   {
    "id": "FR-068",
    "statement": "expose it",
    "source_ids": [
     "FR-068"
    ]
   }
  ],
  "preservation_constraints": [],
  "proof_obligations": [
   {
    "proof_id": "proof-1",
    "statement": "tests pass",
    "obligation_ids": [
     "FR-068-AC-1"
    ],
    "evidence_kind": "Unit",
    "command": {
     "argv": [
      "cargo",
      "test"
     ],
     "working_directory": "."
    },
    "tool_identity": "cargo",
    "configuration_ref": "config/test.toml"
   }
  ],
  "unknowns": []
 },
 "review_workflow": {
  "run_id": "run-1",
  "decision_event_kind": "change_assurance.review_decided"
 }
}
